{
  "ascep_version": "0.1.0",
  "gpu_model": "NVIDIA H100 SXM5",
  "gpu_count": 2,
  "nodes": 1,
  "gpus_per_node": 8,
  "memory_architecture": "discrete",
  "vram_bytes_per_gpu": 85899345920,
  "interconnect_intra_node": "NVLink 4",
  "interconnect_inter_node": null,
  "interconnect_inter_node_u_reason": "(U) single-node campaign only; multi-node scaling not measured",
  "node_exclusivity": "exclusive",
  "driver_version": null,
  "driver_version_u_reason": "(U) not captured at run time",
  "compute_runtime_version": null,
  "compute_runtime_version_u_reason": "(U) not captured at run time",
  "hbm_bandwidth_bytes_s": 3350000000000,
  "dense_bf16_flops_per_s": 989000000000000,
  "dense_flops_precision": "bf16",
  "cpu_model": null,
  "cpu_model_u_reason": "(U) not captured at run time",
  "cpu_cores": null,
  "cpu_cores_u_reason": "(U) not captured at run time",
  "system_ram_bytes": null,
  "system_ram_bytes_u_reason": "(U) not captured at run time",
  "storage_class": null,
  "storage_class_u_reason": "(U) not captured at run time",
  "model_load_path": null,
  "model_load_path_u_reason": "(U) not captured at run time"
}
